{
  "$schema": "http://json-schema.org/draft-07/schema#",
  "$id": "urn:agentops:workflow-dsl:0.1.0:workflow-definition",
  "title": "Agent Ops Workflow Definition",
  "description": "Workflow Definition document (agentops.workflow-definition): logical Workflow — state schema with reducers, graph (nodes/edges/conditional edges), terminals, waits, budgets, recovery, and cross-Workflow handoff declarations. Canonical and Runtime-neutral.",
  "type": "object",
  "required": ["kind", "schemaVersion", "workflow", "state", "graph"],
  "properties": {
    "kind": { "const": "agentops.workflow-definition" },
    "schemaVersion": { "$ref": "urn:agentops:workflow-dsl:0.1.0:meta#/$defs/contractVersion" },
    "workflow": {
      "type": "object",
      "required": ["id", "name", "version", "purpose", "contractVersion"],
      "properties": {
        "id": { "$ref": "urn:agentops:workflow-dsl:0.1.0:meta#/$defs/identity" },
        "name": { "type": "string" },
        "version": { "$ref": "urn:agentops:workflow-dsl:0.1.0:meta#/$defs/version" },
        "purpose": { "type": "string" },
        "contractVersion": { "$ref": "urn:agentops:workflow-dsl:0.1.0:meta#/$defs/contractVersion" }
      },
      "additionalProperties": false
    },
    "state": {
      "type": "object",
      "required": ["fields"],
      "properties": {
        "fields": {
          "type": "array",
          "items": {
            "type": "object",
            "required": ["name", "type"],
            "properties": {
              "name": { "type": "string", "pattern": "^[a-z][A-Za-z0-9_]*$" },
              "type": { "enum": ["string", "integer", "number", "boolean", "array", "object", "artifactRef"] },
              "items": { "$ref": "urn:agentops:workflow-dsl:0.1.0:meta#/$defs/inlineSchema" },
              "schema": { "$ref": "urn:agentops:workflow-dsl:0.1.0:meta#/$defs/schemaRef" },
              "reducer": { "$ref": "urn:agentops:workflow-dsl:0.1.0:meta#/$defs/reducer" },
              "required": { "type": "boolean", "default": false },
              "description": { "type": "string" }
            },
            "additionalProperties": false
          }
        }
      },
      "additionalProperties": false
    },
    "graph": {
      "type": "object",
      "required": ["start", "nodes", "terminals"],
      "properties": {
        "start": {
          "type": "string",
          "description": "Node id where execution starts."
        },
        "nodes": {
          "type": "array",
          "items": {
            "type": "object",
            "required": ["id", "action"],
            "properties": {
              "id": { "$ref": "urn:agentops:workflow-dsl:0.1.0:meta#/$defs/identity" },
              "action": { "$ref": "urn:agentops:workflow-dsl:0.1.0:meta#/$defs/identity" },
              "checkpoint": {
                "type": "object",
                "properties": {
                  "mode": { "enum": ["always", "on-wait", "on-terminal-proposal", "never"], "default": "always" },
                  "bindings": {
                    "type": "array",
                    "items": {
                      "enum": ["delivery", "snapshot", "actionAttempt", "manifestRevision", "gitTree", "artifactVersions", "pendingWait", "budgets", "lastProgress"]
                    },
                    "description": "Minimum required set per spec §9.2: delivery, snapshot, actionAttempt, manifestRevision, gitTree."
                  }
                },
                "additionalProperties": false
              }
            },
            "additionalProperties": false
          }
        },
        "edges": {
          "type": "array",
          "items": {
            "type": "object",
            "required": ["id", "from", "to"],
            "properties": {
              "id": { "$ref": "urn:agentops:workflow-dsl:0.1.0:meta#/$defs/identity" },
              "from": { "$ref": "urn:agentops:workflow-dsl:0.1.0:meta#/$defs/identity" },
              "to": { "type": "string", "description": "Node id or 'terminal:<id>'." },
              "condition": { "$ref": "urn:agentops:workflow-dsl:0.1.0:meta#/$defs/predicate" }
            },
            "additionalProperties": false
          }
        },
        "conditionalEdges": {
          "type": "array",
          "items": {
            "type": "object",
            "required": ["id", "source", "conditions"],
            "properties": {
              "id": { "$ref": "urn:agentops:workflow-dsl:0.1.0:meta#/$defs/identity" },
              "source": { "$ref": "urn:agentops:workflow-dsl:0.1.0:meta#/$defs/identity" },
              "judge": {
                "oneOf": [
                  {
                    "type": "object",
                    "required": ["kind"],
                    "properties": { "kind": { "const": "state" } },
                    "additionalProperties": false,
                    "description": "Default. conditions[].when predicates are evaluated over Workflow State."
                  },
                  {
                    "type": "object",
                    "required": ["kind", "action", "resultSchema"],
                    "properties": {
                      "kind": { "const": "planner" },
                      "action": { "$ref": "urn:agentops:workflow-dsl:0.1.0:meta#/$defs/identity" },
                      "resultSchema": { "$ref": "urn:agentops:workflow-dsl:0.1.0:meta#/$defs/schemaOrInline" }
                    },
                    "additionalProperties": false,
                    "description": "The Runtime invokes the Planner Action's Agent to judge (possibly unstructured) context semantically; the Agent returns a structured classification conforming to resultSchema; the Runtime validates it, then evaluates conditions[].when over that classification to select the target."
                  }
                ],
                "description": "Who decides the branch condition: structured state predicates or a Planner Action's semantic judgment. Judgment belongs to the Agent; branch structure belongs to the Workflow (spec §4.1)."
              },
              "conditions": {
                "type": "array",
                "items": {
                  "type": "object",
                  "required": ["when", "target"],
                  "properties": {
                    "when": { "$ref": "urn:agentops:workflow-dsl:0.1.0:meta#/$defs/predicate" },
                    "target": { "type": "string", "description": "Node id or 'terminal:<id>'." }
                  },
                  "additionalProperties": false
                },
                "minItems": 1
              },
              "default": { "type": "string" }
            },
            "additionalProperties": false
          },
          "description": "A node may have static out-edges OR one conditional edge set, never both (spec §5.5)."
        },
        "terminals": {
          "type": "array",
          "items": {
            "type": "object",
            "required": ["id", "kind", "meaning"],
            "properties": {
              "id": { "$ref": "urn:agentops:workflow-dsl:0.1.0:meta#/$defs/identity" },
              "kind": { "enum": ["success", "failure", "incomplete", "cancelled", "custom"] },
              "meaning": { "type": "string" },
              "validation": { "$ref": "urn:agentops:workflow-dsl:0.1.0:meta#/$defs/identityList" },
              "proposalCheckpoint": { "type": "boolean", "default": true }
            },
            "additionalProperties": false
          }
        }
      },
      "additionalProperties": false
    },
    "waits": {
      "type": "array",
      "items": {
        "type": "object",
        "required": ["id", "kind", "purpose", "triggerAction", "resumeAction", "correlation", "expiry"],
        "properties": {
          "id": { "$ref": "urn:agentops:workflow-dsl:0.1.0:meta#/$defs/identity" },
          "kind": { "enum": ["user", "external", "spike"] },
          "purpose": { "type": "string" },
          "triggerAction": { "$ref": "urn:agentops:workflow-dsl:0.1.0:meta#/$defs/identity" },
          "resumeAction": { "$ref": "urn:agentops:workflow-dsl:0.1.0:meta#/$defs/identity" },
          "resumeSchema": { "$ref": "urn:agentops:workflow-dsl:0.1.0:meta#/$defs/schemaOrInline" },
          "correlation": {
            "type": "object",
            "required": ["identitySource", "staleRejected", "duplicateRejected"],
            "properties": {
              "identitySource": { "type": "string" },
              "staleRejected": { "const": true },
              "duplicateRejected": { "const": true }
            },
            "additionalProperties": false
          },
          "expiry": {
            "type": "object",
            "required": ["policy", "renewalAllowed"],
            "properties": {
              "policy": { "type": "string" },
              "renewalAllowed": { "type": "boolean" }
            },
            "additionalProperties": false
          }
        },
        "additionalProperties": false
      }
    },
    "budgets": {
      "type": "array",
      "items": {
        "type": "object",
        "required": ["id", "scope", "resource", "evaluator", "onExhaustion"],
        "properties": {
          "id": { "$ref": "urn:agentops:workflow-dsl:0.1.0:meta#/$defs/identity" },
          "scope": { "enum": ["workflow", "action"] },
          "action": { "$ref": "urn:agentops:workflow-dsl:0.1.0:meta#/$defs/identity" },
          "resource": { "enum": ["time", "tokens", "context", "custom"] },
          "resourceName": {
            "type": "string",
            "description": "Required when resource=custom: the budget dimension name (e.g. attempts, iterations)."
          },
          "evaluator": {
            "$ref": "urn:agentops:workflow-dsl:0.1.0:meta#/$defs/schemaRef",
            "description": "Content-addressed script registration point; the Runtime invokes it to obtain the budget conclusion. No numeric limit appears in configuration (spec §6.4)."
          },
          "onExhaustion": { "enum": ["incomplete", "wait", "recovery"] },
          "accounting": { "type": "string" }
        },
        "additionalProperties": false,
        "allOf": [
          {
            "if": { "properties": { "resource": { "const": "custom" } } },
            "then": {
              "type": "object",
              "required": ["resourceName"],
              "properties": { "resourceName": {} }
            }
          }
        ]
      },
      "description": "Exhaustion never relaxes a Gate; exhaustion enters the declared terminal/wait/recovery path (spec §6.4). The evaluator is a script registration point invoked by the Runtime; numeric limits are never configured."
    },
    "recovery": {
      "type": "array",
      "items": {
        "type": "object",
        "required": ["id", "mode", "noBlindReplay"],
        "properties": {
          "id": { "$ref": "urn:agentops:workflow-dsl:0.1.0:meta#/$defs/identity" },
          "scope": { "enum": ["workflow", "action"] },
          "action": { "$ref": "urn:agentops:workflow-dsl:0.1.0:meta#/$defs/identity" },
          "mode": { "enum": ["continue", "restartFromSavepoint", "intervene", "fail"] },
          "condition": { "$ref": "urn:agentops:workflow-dsl:0.1.0:meta#/$defs/predicate" },
          "noBlindReplay": { "const": true }
        },
        "additionalProperties": false
      },
      "description": "Recovery is known-continue, known-restart-from-savepoint, or explicit uncertainty to Intervention; never blind replay (spec §6.5)."
    },
    "handoffs": {
      "type": "array",
      "items": {
        "type": "object",
        "required": ["id", "kind", "domainSemantics", "invalidationConditions", "semanticDependency", "requiredEvidence", "returnLocation", "reopenCondition", "semanticOnly"],
        "properties": {
          "id": { "$ref": "urn:agentops:workflow-dsl:0.1.0:meta#/$defs/identity" },
          "kind": {
            "enum": ["CONTRACT_PREREQUISITE", "IMPLEMENTATION_FEASIBILITY", "IMPLEMENTATION_VERIFICATION", "OPERATIONAL_TUNING", "DESIGN_OWNED_PARAMETER", "CUSTOM"]
          },
          "domainSemantics": { "type": "string" },
          "invalidationConditions": { "type": "string" },
          "semanticDependency": { "type": "string" },
          "requiredEvidence": { "type": "string" },
          "returnLocation": { "type": "string" },
          "reopenCondition": { "type": "string" },
          "semanticOnly": {
            "const": true,
            "description": "Upstream handoffs are forbidden from declaring downstream Action/Gate/Wait/terminal fields (spec §10)."
          }
        },
        "additionalProperties": false
      }
    },
    "consumedHandoffs": {
      "type": "array",
      "items": {
        "type": "object",
        "required": ["id", "upstreamHandoff", "classification", "owner", "affectedLocal", "preservesSemantics", "mustNotWeaken"],
        "properties": {
          "id": { "$ref": "urn:agentops:workflow-dsl:0.1.0:meta#/$defs/identity" },
          "upstreamHandoff": {
            "type": "object",
            "required": ["handoff"],
            "properties": {
              "package": { "type": "string" },
              "packageVersion": { "$ref": "urn:agentops:workflow-dsl:0.1.0:meta#/$defs/version" },
              "handoff": { "$ref": "urn:agentops:workflow-dsl:0.1.0:meta#/$defs/identity" }
            },
            "additionalProperties": false
          },
          "classification": { "type": "string" },
          "owner": { "type": "string" },
          "affectedLocal": { "$ref": "urn:agentops:workflow-dsl:0.1.0:meta#/$defs/identityList" },
          "preservesSemantics": {
            "type": "object",
            "required": ["semanticDependency", "reopenCondition"],
            "properties": {
              "semanticDependency": { "type": "string" },
              "reopenCondition": { "type": "string" }
            },
            "additionalProperties": false,
            "description": "Both fields must byte-match the upstream handoff's fields when the upstream package is resolvable (spec §10.3)."
          },
          "mustNotWeaken": { "const": true }
        },
        "additionalProperties": false
      }
    }
  },
  "additionalProperties": false
}
